
Gurobi 11.0.3 (linux64, gurobi_cl) logging started Sun Oct 19 16:52:56 2025

Set parameter Username
Set parameter LogFile to value "gurobi.log"
Using license file /home/guyutongxue/gurobi.lic
Academic license - for non-commercial use only - expires 2026-10-19

Gurobi Optimizer version 11.0.3 build v11.0.3rc0 (linux64 - "Debian GNU/Linux 12 (bookworm)")
Copyright (c) 2024, Gurobi Optimization, LLC

Error reading LP format file output.lp at line 1
Malformed term in expression
Neighboring tokens: " 1 * x831 + 1 * x827 + 1 * "


Error 10012: Unable to read file


Gurobi 11.0.3 (linux64, gurobi_cl) logging started Sun Oct 19 16:56:27 2025

Set parameter Username
Set parameter LogFile to value "gurobi.log"
Using license file /home/guyutongxue/gurobi.lic
Academic license - for non-commercial use only - expires 2026-10-19

Gurobi Optimizer version 11.0.3 build v11.0.3rc0 (linux64 - "Debian GNU/Linux 12 (bookworm)")
Copyright (c) 2024, Gurobi Optimization, LLC

Warning: Numeric variable name in LP file ('0') - often the result
         of a constant term in the left-hand side of a constraint.

Read LP format model from file output.lp
Reading time = 0.00 seconds
: 960 rows, 837 columns, 5824 nonzeros

CPU model: 13th Gen Intel(R) Core(TM) i9-13900KF, instruction set [SSE2|AVX|AVX2]
Thread count: 32 physical cores, 32 logical processors, using up to 32 threads

Optimize a model with 960 rows, 837 columns and 5824 nonzeros
Model fingerprint: 0x1abd8948
Variable types: 5 continuous, 832 integer (832 binary)
Coefficient statistics:
  Matrix range     [1e+00, 4e+00]
  Objective range  [1e+00, 1e+00]
  Bounds range     [1e+00, 1e+00]
  RHS range        [1e+00, 1e+00]
Found heuristic solution: objective 0.0000000

Explored 0 nodes (0 simplex iterations) in 0.00 seconds (0.00 work units)
Thread count was 1 (of 32 available processors)

Solution count 1: 0 

Optimal solution found (tolerance 1.00e-04)
Best objective 0.000000000000e+00, best bound 0.000000000000e+00, gap 0.0000%

Gurobi 11.0.3 (linux64, gurobi_cl) logging started Sun Oct 19 16:59:42 2025

Set parameter Username
Set parameter LogFile to value "gurobi.log"
Using license file /home/guyutongxue/gurobi.lic
Academic license - for non-commercial use only - expires 2026-10-19

Gurobi Optimizer version 11.0.3 build v11.0.3rc0 (linux64 - "Debian GNU/Linux 12 (bookworm)")
Copyright (c) 2024, Gurobi Optimization, LLC

Read LP format model from file output.lp
Reading time = 0.01 seconds
: 960 rows, 832 columns, 4864 nonzeros

CPU model: 13th Gen Intel(R) Core(TM) i9-13900KF, instruction set [SSE2|AVX|AVX2]
Thread count: 32 physical cores, 32 logical processors, using up to 32 threads

Optimize a model with 960 rows, 832 columns and 4864 nonzeros
Model fingerprint: 0x340a2133
Variable types: 0 continuous, 832 integer (832 binary)
Coefficient statistics:
  Matrix range     [1e+00, 4e+00]
  Objective range  [1e+00, 1e+00]
  Bounds range     [1e+00, 1e+00]
  RHS range        [1e+00, 7e+00]
Presolve removed 356 rows and 452 columns
Presolve time: 0.00s
Presolved: 604 rows, 380 columns, 3232 nonzeros
Variable types: 0 continuous, 380 integer (380 binary)
Found heuristic solution: objective 0.0000000

Explored 0 nodes (0 simplex iterations) in 0.01 seconds (0.01 work units)
Thread count was 32 (of 32 available processors)

Solution count 1: 0 

Optimal solution found (tolerance 1.00e-04)
Best objective 0.000000000000e+00, best bound 0.000000000000e+00, gap 0.0000%

Gurobi 11.0.3 (linux64, gurobi_cl) logging started Sun Oct 19 17:01:17 2025

Set parameter Username
Set parameter LogFile to value "gurobi.log"
Using license file /home/guyutongxue/gurobi.lic
Academic license - for non-commercial use only - expires 2026-10-19

Gurobi Optimizer version 11.0.3 build v11.0.3rc0 (linux64 - "Debian GNU/Linux 12 (bookworm)")
Copyright (c) 2024, Gurobi Optimization, LLC

Read LP format model from file output.lp
Reading time = 0.00 seconds
: 960 rows, 832 columns, 4864 nonzeros

CPU model: 13th Gen Intel(R) Core(TM) i9-13900KF, instruction set [SSE2|AVX|AVX2]
Thread count: 32 physical cores, 32 logical processors, using up to 32 threads

Optimize a model with 960 rows, 832 columns and 4864 nonzeros
Model fingerprint: 0x1feaf775
Variable types: 0 continuous, 832 integer (832 binary)
Coefficient statistics:
  Matrix range     [1e+00, 4e+00]
  Objective range  [1e+00, 1e+00]
  Bounds range     [1e+00, 1e+00]
  RHS range        [1e+00, 7e+00]
Found heuristic solution: objective 0.0000000

Explored 0 nodes (0 simplex iterations) in 0.00 seconds (0.00 work units)
Thread count was 1 (of 32 available processors)

Solution count 1: 0 

Optimal solution found (tolerance 1.00e-04)
Best objective 0.000000000000e+00, best bound 0.000000000000e+00, gap 0.0000%

Gurobi 11.0.3 (linux64, gurobi_cl) logging started Sun Oct 19 17:02:38 2025

Set parameter Username
Set parameter LogFile to value "gurobi.log"
Using license file /home/guyutongxue/gurobi.lic
Academic license - for non-commercial use only - expires 2026-10-19

Gurobi Optimizer version 11.0.3 build v11.0.3rc0 (linux64 - "Debian GNU/Linux 12 (bookworm)")
Copyright (c) 2024, Gurobi Optimization, LLC

Read LP format model from file output.lp
Reading time = 0.01 seconds
: 960 rows, 832 columns, 4864 nonzeros

CPU model: 13th Gen Intel(R) Core(TM) i9-13900KF, instruction set [SSE2|AVX|AVX2]
Thread count: 32 physical cores, 32 logical processors, using up to 32 threads

Optimize a model with 960 rows, 832 columns and 4864 nonzeros
Model fingerprint: 0x340a2133
Variable types: 0 continuous, 832 integer (832 binary)
Coefficient statistics:
  Matrix range     [1e+00, 4e+00]
  Objective range  [1e+00, 1e+00]
  Bounds range     [1e+00, 1e+00]
  RHS range        [1e+00, 7e+00]
Presolve removed 356 rows and 452 columns
Presolve time: 0.01s
Presolved: 604 rows, 380 columns, 3232 nonzeros
Variable types: 0 continuous, 380 integer (380 binary)
Found heuristic solution: objective 0.0000000

Explored 0 nodes (0 simplex iterations) in 0.01 seconds (0.01 work units)
Thread count was 32 (of 32 available processors)

Solution count 1: 0 

Optimal solution found (tolerance 1.00e-04)
Best objective 0.000000000000e+00, best bound 0.000000000000e+00, gap 0.0000%

Gurobi 11.0.3 (linux64, gurobi_cl) logging started Sun Oct 19 17:33:22 2025

Set parameter Username
Set parameter LogFile to value "gurobi.log"
Using license file /home/guyutongxue/gurobi.lic
Academic license - for non-commercial use only - expires 2026-10-19

Gurobi Optimizer version 11.0.3 build v11.0.3rc0 (linux64 - "Debian GNU/Linux 12 (bookworm)")
Copyright (c) 2024, Gurobi Optimization, LLC

Read LP format model from file output.lp
Reading time = 0.00 seconds
: 704 rows, 320 columns, 4096 nonzeros

CPU model: 13th Gen Intel(R) Core(TM) i9-13900KF, instruction set [SSE2|AVX|AVX2]
Thread count: 32 physical cores, 32 logical processors, using up to 32 threads

Optimize a model with 704 rows, 320 columns and 4096 nonzeros
Model fingerprint: 0xc961a529
Variable types: 0 continuous, 320 integer (320 binary)
Coefficient statistics:
  Matrix range     [1e+00, 4e+00]
  Objective range  [1e+00, 1e+00]
  Bounds range     [1e+00, 1e+00]
  RHS range        [1e+00, 7e+00]
Presolve removed 568 rows and 236 columns
Presolve time: 0.01s
Presolved: 136 rows, 84 columns, 804 nonzeros
Variable types: 0 continuous, 84 integer (84 binary)
Found heuristic solution: objective 18.0000000
Found heuristic solution: objective 16.0000000

Root relaxation: objective 1.000000e+01, 73 iterations, 0.00 seconds (0.00 work units)

    Nodes    |    Current Node    |     Objective Bounds      |     Work
 Expl Unexpl |  Obj  Depth IntInf | Incumbent    BestBd   Gap | It/Node Time

     0     0   10.00000    0   17   16.00000   10.00000  37.5%     -    0s
H    0     0                      15.0000000   10.00000  33.3%     -    0s
H    0     0                      14.0000000   10.00000  28.6%     -    0s
     0     0   11.00000    0   10   14.00000   11.00000  21.4%     -    0s
H    0     0                      13.0000000   11.00000  15.4%     -    0s
     0     0   11.00000    0   33   13.00000   11.00000  15.4%     -    0s
     0     0   11.00000    0   11   13.00000   11.00000  15.4%     -    0s
     0     0   12.00000    0    8   13.00000   12.00000  7.69%     -    0s
     0     0   12.00000    0   21   13.00000   12.00000  7.69%     -    0s
     0     0   12.00000    0   28   13.00000   12.00000  7.69%     -    0s
     0     0   12.00000    0   26   13.00000   12.00000  7.69%     -    0s
     0     0   12.00000    0   22   13.00000   12.00000  7.69%     -    0s
     0     0   12.00000    0   22   13.00000   12.00000  7.69%     -    0s
     0     2   12.00000    0   22   13.00000   12.00000  7.69%     -    0s

Cutting planes:
  Gomory: 2
  Cover: 5
  MIR: 4
  Flow cover: 2

Explored 7 nodes (466 simplex iterations) in 0.08 seconds (0.03 work units)
Thread count was 32 (of 32 available processors)

Solution count 9: 13 13 14 ... 19

Optimal solution found (tolerance 1.00e-04)
Best objective 1.300000000000e+01, best bound 1.300000000000e+01, gap 0.0000%

Gurobi 11.0.3 (linux64, gurobi_cl) logging started Sun Oct 19 17:36:07 2025

Set parameter Username
Set parameter LogFile to value "gurobi.log"
Using license file /home/guyutongxue/gurobi.lic
Academic license - for non-commercial use only - expires 2026-10-19

Gurobi Optimizer version 11.0.3 build v11.0.3rc0 (linux64 - "Debian GNU/Linux 12 (bookworm)")
Copyright (c) 2024, Gurobi Optimization, LLC

Read LP format model from file output.lp
Reading time = 0.01 seconds
: 1504 rows, 640 columns, 9136 nonzeros

CPU model: 13th Gen Intel(R) Core(TM) i9-13900KF, instruction set [SSE2|AVX|AVX2]
Thread count: 32 physical cores, 32 logical processors, using up to 32 threads

Optimize a model with 1504 rows, 640 columns and 9136 nonzeros
Model fingerprint: 0x0749b01f
Variable types: 0 continuous, 640 integer (640 binary)
Coefficient statistics:
  Matrix range     [1e+00, 4e+00]
  Objective range  [1e+00, 1e+00]
  Bounds range     [1e+00, 1e+00]
  RHS range        [1e+00, 7e+00]
Presolve removed 564 rows and 224 columns
Presolve time: 0.01s
Presolved: 940 rows, 416 columns, 5842 nonzeros
Variable types: 0 continuous, 416 integer (416 binary)

Root relaxation: objective 1.385518e-02, 898 iterations, 0.01 seconds (0.03 work units)

    Nodes    |    Current Node    |     Objective Bounds      |     Work
 Expl Unexpl |  Obj  Depth IntInf | Incumbent    BestBd   Gap | It/Node Time

     0     0    0.01386    0   70          -    0.01386      -     -    0s
H    0     0                       8.0000000    0.01386   100%     -    0s
H    0     0                       1.0000000    0.01386  98.6%     -    0s

Explored 1 nodes (945 simplex iterations) in 0.03 seconds (0.06 work units)
Thread count was 32 (of 32 available processors)

Solution count 2: 1 8 

Optimal solution found (tolerance 1.00e-04)
Best objective 1.000000000000e+00, best bound 1.000000000000e+00, gap 0.0000%

Gurobi 11.0.3 (linux64, gurobi_cl) logging started Sun Oct 19 17:36:40 2025

Set parameter Username
Set parameter LogFile to value "gurobi.log"
Using license file /home/guyutongxue/gurobi.lic
Academic license - for non-commercial use only - expires 2026-10-19

Gurobi Optimizer version 11.0.3 build v11.0.3rc0 (linux64 - "Debian GNU/Linux 12 (bookworm)")
Copyright (c) 2024, Gurobi Optimization, LLC

Read LP format model from file output.lp
Reading time = 0.00 seconds
: 1504 rows, 640 columns, 9136 nonzeros

CPU model: 13th Gen Intel(R) Core(TM) i9-13900KF, instruction set [SSE2|AVX|AVX2]
Thread count: 32 physical cores, 32 logical processors, using up to 32 threads

Optimize a model with 1504 rows, 640 columns and 9136 nonzeros
Model fingerprint: 0x51dd0316
Variable types: 0 continuous, 640 integer (640 binary)
Coefficient statistics:
  Matrix range     [1e+00, 4e+00]
  Objective range  [1e+00, 1e+00]
  Bounds range     [1e+00, 1e+00]
  RHS range        [1e+00, 7e+00]
Presolve removed 491 rows and 204 columns
Presolve time: 0.01s
Presolved: 1013 rows, 436 columns, 6240 nonzeros
Variable types: 0 continuous, 436 integer (436 binary)

Root relaxation: objective 1.374748e-02, 913 iterations, 0.02 seconds (0.03 work units)

    Nodes    |    Current Node    |     Objective Bounds      |     Work
 Expl Unexpl |  Obj  Depth IntInf | Incumbent    BestBd   Gap | It/Node Time

     0     0    0.01375    0   86          -    0.01375      -     -    0s
H    0     0                       6.0000000    0.01375   100%     -    0s
H    0     0                       2.0000000    0.01375  99.3%     -    0s
H    0     0                       1.0000000    0.01375  98.6%     -    0s

Cutting planes:
  Gomory: 1

Explored 1 nodes (1026 simplex iterations) in 0.04 seconds (0.07 work units)
Thread count was 32 (of 32 available processors)

Solution count 3: 1 2 6 

Optimal solution found (tolerance 1.00e-04)
Best objective 1.000000000000e+00, best bound 1.000000000000e+00, gap 0.0000%

Gurobi 11.0.3 (linux64, gurobi_cl) logging started Sun Oct 19 17:36:53 2025

Set parameter Username
Set parameter LogFile to value "gurobi.log"
Using license file /home/guyutongxue/gurobi.lic
Academic license - for non-commercial use only - expires 2026-10-19

Gurobi Optimizer version 11.0.3 build v11.0.3rc0 (linux64 - "Debian GNU/Linux 12 (bookworm)")
Copyright (c) 2024, Gurobi Optimization, LLC

Read LP format model from file output.lp
Reading time = 0.01 seconds
: 1344 rows, 576 columns, 8128 nonzeros

CPU model: 13th Gen Intel(R) Core(TM) i9-13900KF, instruction set [SSE2|AVX|AVX2]
Thread count: 32 physical cores, 32 logical processors, using up to 32 threads

Optimize a model with 1344 rows, 576 columns and 8128 nonzeros
Model fingerprint: 0xf9944e4b
Variable types: 0 continuous, 576 integer (576 binary)
Coefficient statistics:
  Matrix range     [1e+00, 4e+00]
  Objective range  [1e+00, 1e+00]
  Bounds range     [1e+00, 1e+00]
  RHS range        [1e+00, 7e+00]
Presolve removed 564 rows and 224 columns
Presolve time: 0.01s
Presolved: 780 rows, 352 columns, 4834 nonzeros
Variable types: 0 continuous, 352 integer (352 binary)
Found heuristic solution: objective 7.0000000

Root relaxation: objective 6.003103e-02, 694 iterations, 0.01 seconds (0.02 work units)

    Nodes    |    Current Node    |     Objective Bounds      |     Work
 Expl Unexpl |  Obj  Depth IntInf | Incumbent    BestBd   Gap | It/Node Time

     0     0    0.06003    0   61    7.00000    0.06003  99.1%     -    0s
H    0     0                       4.0000000    0.06003  98.5%     -    0s
H    0     0                       2.0000000    0.06003  97.0%     -    0s
     0     0    0.16667    0   33    2.00000    0.16667  91.7%     -    0s
     0     0    0.16988    0   20    2.00000    0.16988  91.5%     -    0s
H    0     0                       1.0000000    0.20051  79.9%     -    0s
     0     0    1.00000    0   58    1.00000    1.00000  0.00%     -    0s

Cutting planes:
  Gomory: 6
  Cover: 23
  MIR: 13
  StrongCG: 1
  Zero half: 1
  RLT: 2

Explored 1 nodes (1262 simplex iterations) in 0.07 seconds (0.07 work units)
Thread count was 32 (of 32 available processors)

Solution count 4: 1 2 4 7 

Optimal solution found (tolerance 1.00e-04)
Best objective 1.000000000000e+00, best bound 1.000000000000e+00, gap 0.0000%

Gurobi 11.0.3 (linux64, gurobi_cl) logging started Sun Oct 19 17:37:28 2025

Set parameter Username
Set parameter LogFile to value "gurobi.log"
Using license file /home/guyutongxue/gurobi.lic
Academic license - for non-commercial use only - expires 2026-10-19

Gurobi Optimizer version 11.0.3 build v11.0.3rc0 (linux64 - "Debian GNU/Linux 12 (bookworm)")
Copyright (c) 2024, Gurobi Optimization, LLC

Read LP format model from file output.lp
Reading time = 0.01 seconds
: 1184 rows, 512 columns, 7120 nonzeros

CPU model: 13th Gen Intel(R) Core(TM) i9-13900KF, instruction set [SSE2|AVX|AVX2]
Thread count: 32 physical cores, 32 logical processors, using up to 32 threads

Optimize a model with 1184 rows, 512 columns and 7120 nonzeros
Model fingerprint: 0x13268fe5
Variable types: 0 continuous, 512 integer (512 binary)
Coefficient statistics:
  Matrix range     [1e+00, 4e+00]
  Objective range  [1e+00, 1e+00]
  Bounds range     [1e+00, 1e+00]
  RHS range        [1e+00, 7e+00]
Presolve removed 564 rows and 224 columns
Presolve time: 0.01s
Presolved: 620 rows, 288 columns, 3826 nonzeros
Variable types: 0 continuous, 288 integer (288 binary)
Found heuristic solution: objective 8.0000000
Found heuristic solution: objective 7.0000000

Root relaxation: objective 2.592432e-01, 463 iterations, 0.01 seconds (0.01 work units)

    Nodes    |    Current Node    |     Objective Bounds      |     Work
 Expl Unexpl |  Obj  Depth IntInf | Incumbent    BestBd   Gap | It/Node Time

     0     0    0.25924    0   64    7.00000    0.25924  96.3%     -    0s
H    0     0                       6.0000000    0.25924  95.7%     -    0s
H    0     0                       3.0000000    0.25924  91.4%     -    0s
     0     0    0.29322    0   91    3.00000    0.29322  90.2%     -    0s
H    0     0                       2.0000000    0.29322  85.3%     -    0s
     0     0    0.30888    0   82    2.00000    0.30888  84.6%     -    0s
     0     0    0.32505    0   90    2.00000    0.32505  83.7%     -    0s
     0     0    0.39293    0   75    2.00000    0.39293  80.4%     -    0s
     0     0    0.67814    0   89    2.00000    0.67814  66.1%     -    0s
     0     0    1.00000    0   97    2.00000    1.00000  50.0%     -    0s
H    0     0                       1.0000000    1.00000  0.00%     -    0s

Cutting planes:
  Gomory: 1
  Cover: 65
  MIR: 45
  StrongCG: 5
  Zero half: 4
  RLT: 6

Explored 1 nodes (1179 simplex iterations) in 0.07 seconds (0.09 work units)
Thread count was 32 (of 32 available processors)

Solution count 6: 1 2 3 ... 8

Optimal solution found (tolerance 1.00e-04)
Best objective 1.000000000000e+00, best bound 1.000000000000e+00, gap 0.0000%

Gurobi 11.0.3 (linux64, gurobi_cl) logging started Sun Oct 19 17:37:37 2025

Set parameter Username
Set parameter LogFile to value "gurobi.log"
Using license file /home/guyutongxue/gurobi.lic
Academic license - for non-commercial use only - expires 2026-10-19

Gurobi Optimizer version 11.0.3 build v11.0.3rc0 (linux64 - "Debian GNU/Linux 12 (bookworm)")
Copyright (c) 2024, Gurobi Optimization, LLC

Read LP format model from file output.lp
Reading time = 0.01 seconds
: 1024 rows, 448 columns, 6112 nonzeros

CPU model: 13th Gen Intel(R) Core(TM) i9-13900KF, instruction set [SSE2|AVX|AVX2]
Thread count: 32 physical cores, 32 logical processors, using up to 32 threads

Optimize a model with 1024 rows, 448 columns and 6112 nonzeros
Model fingerprint: 0xc396ed2e
Variable types: 0 continuous, 448 integer (448 binary)
Coefficient statistics:
  Matrix range     [1e+00, 4e+00]
  Objective range  [1e+00, 1e+00]
  Bounds range     [1e+00, 1e+00]
  RHS range        [1e+00, 7e+00]
Presolve removed 564 rows and 224 columns
Presolve time: 0.02s
Presolved: 460 rows, 224 columns, 2818 nonzeros
Variable types: 0 continuous, 224 integer (224 binary)
Found heuristic solution: objective 9.0000000

Root relaxation: objective 1.051146e+00, 239 iterations, 0.00 seconds (0.00 work units)

    Nodes    |    Current Node    |     Objective Bounds      |     Work
 Expl Unexpl |  Obj  Depth IntInf | Incumbent    BestBd   Gap | It/Node Time

     0     0    1.05115    0   43    9.00000    1.05115  88.3%     -    0s
H    0     0                       7.0000000    1.05115  85.0%     -    0s
H    0     0                       5.0000000    1.05115  79.0%     -    0s
     0     0    1.25185    0   75    5.00000    1.25185  75.0%     -    0s
H    0     0                       4.0000000    1.25185  68.7%     -    0s
     0     0    1.29924    0   70    4.00000    1.29924  67.5%     -    0s
     0     0    1.40572    0   72    4.00000    1.40572  64.9%     -    0s
H    0     0                       3.0000000    1.40572  53.1%     -    0s
     0     0    1.40818    0   69    3.00000    1.40818  53.1%     -    0s
     0     0    1.46096    0   65    3.00000    1.46096  51.3%     -    0s
     0     0    1.55633    0   51    3.00000    1.55633  48.1%     -    0s
     0     0    1.56019    0   56    3.00000    1.56019  48.0%     -    0s
     0     0    1.56019    0   60    3.00000    1.56019  48.0%     -    0s
     0     0    1.62222    0   74    3.00000    1.62222  45.9%     -    0s
     0     0    1.72222    0   56    3.00000    1.72222  42.6%     -    0s
     0     0    1.72222    0   66    3.00000    1.72222  42.6%     -    0s
     0     0    1.72222    0   57    3.00000    1.72222  42.6%     -    0s
     0     0    1.72222    0   60    3.00000    1.72222  42.6%     -    0s
     0     0    1.72222    0   53    3.00000    1.72222  42.6%     -    0s
     0     0    1.72222    0   65    3.00000    1.72222  42.6%     -    0s
     0     0    1.72222    0   61    3.00000    1.72222  42.6%     -    0s
     0     0    1.72222    0   37    3.00000    1.72222  42.6%     -    0s
     0     2    1.72222    0   23    3.00000    1.72222  42.6%     -    0s

Cutting planes:
  Gomory: 6
  Cover: 152
  MIR: 99
  StrongCG: 2
  Zero half: 12
  Mod-K: 1
  RLT: 7

Explored 1574 nodes (94336 simplex iterations) in 0.39 seconds (0.44 work units)
Thread count was 32 (of 32 available processors)

Solution count 5: 3 4 5 ... 9

Optimal solution found (tolerance 1.00e-04)
Best objective 3.000000000000e+00, best bound 3.000000000000e+00, gap 0.0000%

Gurobi 11.0.3 (linux64, gurobi_cl) logging started Mon Oct 20 10:29:15 2025

Set parameter Username
Set parameter LogFile to value "gurobi.log"
Using license file /home/guyutongxue/gurobi.lic
Academic license - for non-commercial use only - expires 2026-10-19

Gurobi Optimizer version 11.0.3 build v11.0.3rc0 (linux64 - "Debian GNU/Linux 12 (bookworm)")
Copyright (c) 2024, Gurobi Optimization, LLC

Read LP format model from file output.lp
Reading time = 0.00 seconds
: 1504 rows, 640 columns, 9136 nonzeros

CPU model: 13th Gen Intel(R) Core(TM) i9-13900KF, instruction set [SSE2|AVX|AVX2]
Thread count: 32 physical cores, 32 logical processors, using up to 32 threads

Optimize a model with 1504 rows, 640 columns and 9136 nonzeros
Model fingerprint: 0x71e46fb5
Variable types: 0 continuous, 640 integer (640 binary)
Coefficient statistics:
  Matrix range     [1e+00, 4e+00]
  Objective range  [1e+00, 1e+00]
  Bounds range     [1e+00, 1e+00]
  RHS range        [1e+00, 7e+00]
Presolve removed 408 rows and 180 columns
Presolve time: 0.01s
Presolved: 1096 rows, 460 columns, 6632 nonzeros
Variable types: 0 continuous, 460 integer (460 binary)

Root relaxation: objective 1.163374e-02, 1730 iterations, 0.03 seconds (0.06 work units)

    Nodes    |    Current Node    |     Objective Bounds      |     Work
 Expl Unexpl |  Obj  Depth IntInf | Incumbent    BestBd   Gap | It/Node Time

     0     0    0.01163    0  117          -    0.01163      -     -    0s
H    0     0                       7.0000000    0.01163   100%     -    0s
H    0     0                       4.0000000    0.01163   100%     -    0s
H    0     0                       3.0000000    0.01163   100%     -    0s
H    0     0                       2.0000000    0.01163  99.4%     -    0s
     0     0    0.16667    0   98    2.00000    0.16667  91.7%     -    0s
     0     0    0.16667    0  103    2.00000    0.16667  91.7%     -    0s
     0     0    1.00000    0  107    2.00000    1.00000  50.0%     -    0s
H    0     0                       1.0000000    1.00000  0.00%     -    0s
     0     0    1.00000    0  107    1.00000    1.00000  0.00%     -    0s

Cutting planes:
  Gomory: 8
  Cover: 23
  Clique: 2
  MIR: 24
  Zero half: 7
  RLT: 2

Explored 1 nodes (2417 simplex iterations) in 0.09 seconds (0.15 work units)
Thread count was 32 (of 32 available processors)

Solution count 5: 1 2 3 ... 7

Optimal solution found (tolerance 1.00e-04)
Best objective 1.000000000000e+00, best bound 1.000000000000e+00, gap 0.0000%

Gurobi 11.0.3 (linux64, gurobi_cl) logging started Wed Nov 12 18:25:47 2025

Set parameter Username
Set parameter LogFile to value "gurobi.log"
Using license file /home/guyutongxue/gurobi.lic
Academic license - for non-commercial use only - expires 2026-10-19

Gurobi Optimizer version 11.0.3 build v11.0.3rc0 (linux64 - "Debian GNU/Linux 12 (bookworm)")
Copyright (c) 2024, Gurobi Optimization, LLC

Read LP format model from file test.lp
Reading time = 0.01 seconds
: 1792 rows, 640 columns, 11136 nonzeros

CPU model: 13th Gen Intel(R) Core(TM) i9-13900KF, instruction set [SSE2|AVX|AVX2]
Thread count: 32 physical cores, 32 logical processors, using up to 32 threads

Optimize a model with 1792 rows, 640 columns and 11136 nonzeros
Model fingerprint: 0x9cc47df8
Variable types: 0 continuous, 640 integer (640 binary)
Coefficient statistics:
  Matrix range     [1e+00, 5e+00]
  Objective range  [1e+00, 1e+00]
  Bounds range     [1e+00, 1e+00]
  RHS range        [1e+00, 8e+00]
Presolve removed 1786 rows and 636 columns
Presolve time: 0.00s
Presolved: 6 rows, 4 columns, 22 nonzeros
Variable types: 0 continuous, 4 integer (4 binary)
Found heuristic solution: objective 32.0000000

Explored 0 nodes (0 simplex iterations) in 0.00 seconds (0.00 work units)
Thread count was 32 (of 32 available processors)

Solution count 1: 32 

Optimal solution found (tolerance 1.00e-04)
Best objective 3.200000000000e+01, best bound 3.200000000000e+01, gap 0.0000%

Gurobi 11.0.3 (linux64, gurobi_cl) logging started Wed Nov 12 18:26:00 2025

Set parameter Username
Set parameter LogFile to value "gurobi.log"
Using license file /home/guyutongxue/gurobi.lic
Academic license - for non-commercial use only - expires 2026-10-19

Gurobi Optimizer version 11.0.3 build v11.0.3rc0 (linux64 - "Debian GNU/Linux 12 (bookworm)")
Copyright (c) 2024, Gurobi Optimization, LLC

Read LP format model from file test.lp
Reading time = 0.00 seconds
: 3040 rows, 1024 columns, 19392 nonzeros

CPU model: 13th Gen Intel(R) Core(TM) i9-13900KF, instruction set [SSE2|AVX|AVX2]
Thread count: 32 physical cores, 32 logical processors, using up to 32 threads

Optimize a model with 3040 rows, 1024 columns and 19392 nonzeros
Model fingerprint: 0xd3adff5f
Variable types: 0 continuous, 1024 integer (1024 binary)
Coefficient statistics:
  Matrix range     [1e+00, 5e+00]
  Objective range  [1e+00, 1e+00]
  Bounds range     [1e+00, 1e+00]
  RHS range        [1e+00, 8e+00]
Presolve removed 1680 rows and 528 columns
Presolve time: 0.01s
Presolved: 1360 rows, 496 columns, 8656 nonzeros
Variable types: 0 continuous, 496 integer (496 binary)
Found heuristic solution: objective 32.0000000
Found heuristic solution: objective 24.0000000

Root relaxation: objective 0.000000e+00, 197 iterations, 0.00 seconds (0.00 work units)

    Nodes    |    Current Node    |     Objective Bounds      |     Work
 Expl Unexpl |  Obj  Depth IntInf | Incumbent    BestBd   Gap | It/Node Time

     0     0    0.00000    0   51   24.00000    0.00000   100%     -    0s
H    0     0                      19.0000000    0.00000   100%     -    0s
H    0     0                      15.0000000    0.00000   100%     -    0s
H    0     0                      13.0000000    0.00000   100%     -    0s
H    0     0                      11.0000000    0.00000   100%     -    0s
     0     0    0.00000    0   80   11.00000    0.00000   100%     -    0s
H    0     0                      10.0000000    0.00000   100%     -    0s
H    0     0                       9.0000000    0.00000   100%     -    0s
     0     0    0.67772    0  190    9.00000    0.67772  92.5%     -    0s
     0     0    0.79651    0  181    9.00000    0.79651  91.1%     -    0s
     0     0    0.81165    0  176    9.00000    0.81165  91.0%     -    0s
     0     0    0.81796    0  187    9.00000    0.81796  90.9%     -    0s
     0     0    0.81861    0  197    9.00000    0.81861  90.9%     -    0s
     0     0    1.16124    0  217    9.00000    1.16124  87.1%     -    0s
H    0     0                       8.0000000    1.16124  85.5%     -    0s
     0     0    1.28540    0  165    8.00000    1.28540  83.9%     -    0s
H    0     0                       7.0000000    1.31427  81.2%     -    0s
     0     0    1.31427    0  159    7.00000    1.31427  81.2%     -    0s
     0     0    1.32747    0  162    7.00000    1.32747  81.0%     -    0s
     0     0    1.32847    0  183    7.00000    1.32847  81.0%     -    0s
     0     0    1.33056    0  189    7.00000    1.33056  81.0%     -    0s
     0     0    1.33399    0  225    7.00000    1.33399  80.9%     -    0s
     0     0    1.33508    0  200    7.00000    1.33508  80.9%     -    0s
     0     0    1.33508    0  201    7.00000    1.33508  80.9%     -    0s
H    0     0                       6.0000000    1.33508  77.7%     -    0s
     0     0    1.47272    0  215    6.00000    1.47272  75.5%     -    0s
     0     0    1.50170    0  187    6.00000    1.50170  75.0%     -    0s
     0     0    1.51695    0  202    6.00000    1.51695  74.7%     -    0s
     0     0    1.54258    0  192    6.00000    1.54258  74.3%     -    0s
     0     0    1.55007    0  170    6.00000    1.55007  74.2%     -    0s
     0     0    1.56510    0  175    6.00000    1.56510  73.9%     -    0s
     0     0    1.56976    0  201    6.00000    1.56976  73.8%     -    0s
     0     0    1.57060    0  205    6.00000    1.57060  73.8%     -    0s
     0     0    1.57290    0  208    6.00000    1.57290  73.8%     -    0s
     0     0    1.57290    0  213    6.00000    1.57290  73.8%     -    0s
     0     0    1.65704    0  183    6.00000    1.65704  72.4%     -    0s
     0     0    1.70206    0  161    6.00000    1.70206  71.6%     -    0s
     0     0    1.72463    0  168    6.00000    1.72463  71.3%     -    0s
     0     0    1.73373    0  158    6.00000    1.73373  71.1%     -    0s
     0     0    1.74229    0  176    6.00000    1.74229  71.0%     -    0s
     0     0    1.75047    0  184    6.00000    1.75047  70.8%     -    0s
     0     0    1.75433    0  213    6.00000    1.75433  70.8%     -    0s
     0     0    1.75766    0  227    6.00000    1.75766  70.7%     -    0s
     0     0    1.75887    0  221    6.00000    1.75887  70.7%     -    0s
     0     0    1.75999    0  246    6.00000    1.75999  70.7%     -    0s
     0     0    1.76029    0  219    6.00000    1.76029  70.7%     -    0s
     0     0    1.83399    0  208    6.00000    1.83399  69.4%     -    0s
     0     0    1.85581    0  183    6.00000    1.85581  69.1%     -    0s
     0     0    1.87073    0  251    6.00000    1.87073  68.8%     -    0s
     0     0    1.87584    0  246    6.00000    1.87584  68.7%     -    0s
     0     0    1.87882    0  239    6.00000    1.87882  68.7%     -    0s
     0     0    1.88033    0  236    6.00000    1.88033  68.7%     -    0s
     0     0    1.88063    0  253    6.00000    1.88063  68.7%     -    0s
     0     0    1.93484    0  206    6.00000    1.93484  67.8%     -    0s
     0     0    1.94938    0  212    6.00000    1.94938  67.5%     -    0s
     0     0    1.94970    0  197    6.00000    1.94970  67.5%     -    0s
H    0     0                       5.0000000    1.98700  60.3%     -    0s
     0     0    1.98700    0  161    5.00000    1.98700  60.3%     -    0s
     0     0    1.99154    0  185    5.00000    1.99154  60.2%     -    0s
     0     0    2.00000    0  176    5.00000    2.00000  60.0%     -    0s
     0     0    2.00000    0  195    5.00000    2.00000  60.0%     -    0s
     0     0    2.00000    0  196    5.00000    2.00000  60.0%     -    0s
     0     0    2.00000    0  246    5.00000    2.00000  60.0%     -    0s
     0     0    2.00000    0  236    5.00000    2.00000  60.0%     -    0s
     0     0    2.00000    0  132    5.00000    2.00000  60.0%     -    0s
     0     2    2.00000    0  112    5.00000    2.00000  60.0%     -    0s
H   45    64                       4.0000000    2.00000  50.0%   229    0s
H   96   115                       3.0000000    2.00000  33.3%   218    1s

Cutting planes:
  Gomory: 6
  Cover: 62
  MIR: 97
  Flow cover: 1
  GUB cover: 2
  RLT: 20

Explored 132 nodes (35740 simplex iterations) in 1.31 seconds (2.14 work units)
Thread count was 32 (of 32 available processors)

Solution count 10: 3 4 5 ... 13

Optimal solution found (tolerance 1.00e-04)
Best objective 3.000000000000e+00, best bound 3.000000000000e+00, gap 0.0000%

Gurobi 11.0.3 (linux64, gurobi_cl) logging started Wed Nov 12 18:26:13 2025

Set parameter Username
Set parameter LogFile to value "gurobi.log"
Using license file /home/guyutongxue/gurobi.lic
Academic license - for non-commercial use only - expires 2026-10-19

Gurobi Optimizer version 11.0.3 build v11.0.3rc0 (linux64 - "Debian GNU/Linux 12 (bookworm)")
Copyright (c) 2024, Gurobi Optimization, LLC

Read LP format model from file test.lp
Reading time = 0.01 seconds
: 3872 rows, 1280 columns, 24896 nonzeros

CPU model: 13th Gen Intel(R) Core(TM) i9-13900KF, instruction set [SSE2|AVX|AVX2]
Thread count: 32 physical cores, 32 logical processors, using up to 32 threads

Optimize a model with 3872 rows, 1280 columns and 24896 nonzeros
Model fingerprint: 0x193c1f7a
Variable types: 0 continuous, 1280 integer (1280 binary)
Coefficient statistics:
  Matrix range     [1e+00, 5e+00]
  Objective range  [1e+00, 1e+00]
  Bounds range     [1e+00, 1e+00]
  RHS range        [1e+00, 8e+00]
Presolve removed 1680 rows and 528 columns
Presolve time: 0.02s
Presolved: 2192 rows, 752 columns, 14160 nonzeros
Variable types: 0 continuous, 752 integer (752 binary)
Found heuristic solution: objective 24.0000000

Root relaxation: objective 0.000000e+00, 220 iterations, 0.00 seconds (0.00 work units)

    Nodes    |    Current Node    |     Objective Bounds      |     Work
 Expl Unexpl |  Obj  Depth IntInf | Incumbent    BestBd   Gap | It/Node Time

     0     0    0.00000    0   24   24.00000    0.00000   100%     -    0s
H    0     0                       8.0000000    0.00000   100%     -    0s
H    0     0                       6.0000000    0.00000   100%     -    0s
H    0     0                       4.0000000    0.00000   100%     -    0s
H    0     0                       3.0000000    0.00000   100%     -    0s
     0     0    0.00000    0   49    3.00000    0.00000   100%     -    0s
     0     0    0.00000    0   45    3.00000    0.00000   100%     -    0s
     0     0    0.00000    0   32    3.00000    0.00000   100%     -    0s
     0     0    0.00000    0   37    3.00000    0.00000   100%     -    0s
     0     0    0.00000    0   37    3.00000    0.00000   100%     -    0s
     0     0    0.00000    0   37    3.00000    0.00000   100%     -    0s
     0     0    0.00000    0   37    3.00000    0.00000   100%     -    0s
     0     0    0.00000    0   37    3.00000    0.00000   100%     -    0s
     0     2    1.00000    0   24    3.00000    1.00000  66.7%     -    0s
H   34    64                       2.0000000    1.00000  50.0%   323    0s
H   96   124                       1.0000000    1.00000  0.00%   272    0s

Cutting planes:
  Gomory: 10
  Cover: 292
  MIR: 29
  StrongCG: 1
  Zero half: 2
  RLT: 2

Explored 127 nodes (33511 simplex iterations) in 0.54 seconds (0.89 work units)
Thread count was 32 (of 32 available processors)

Solution count 7: 1 2 3 ... 24

Optimal solution found (tolerance 1.00e-04)
Best objective 1.000000000000e+00, best bound 1.000000000000e+00, gap 0.0000%

Gurobi 11.0.3 (linux64, gurobi_cl) logging started Wed Nov 12 18:26:25 2025

Set parameter Username
Set parameter LogFile to value "gurobi.log"
Using license file /home/guyutongxue/gurobi.lic
Academic license - for non-commercial use only - expires 2026-10-19

Gurobi Optimizer version 11.0.3 build v11.0.3rc0 (linux64 - "Debian GNU/Linux 12 (bookworm)")
Copyright (c) 2024, Gurobi Optimization, LLC

Read LP format model from file test.lp
Reading time = 0.01 seconds
: 3456 rows, 1152 columns, 22144 nonzeros

CPU model: 13th Gen Intel(R) Core(TM) i9-13900KF, instruction set [SSE2|AVX|AVX2]
Thread count: 32 physical cores, 32 logical processors, using up to 32 threads

Optimize a model with 3456 rows, 1152 columns and 22144 nonzeros
Model fingerprint: 0xd50b0dfc
Variable types: 0 continuous, 1152 integer (1152 binary)
Coefficient statistics:
  Matrix range     [1e+00, 5e+00]
  Objective range  [1e+00, 1e+00]
  Bounds range     [1e+00, 1e+00]
  RHS range        [1e+00, 8e+00]
Presolve removed 1680 rows and 528 columns
Presolve time: 0.01s
Presolved: 1776 rows, 624 columns, 11408 nonzeros
Variable types: 0 continuous, 624 integer (624 binary)
Found heuristic solution: objective 24.0000000

Root relaxation: objective 0.000000e+00, 184 iterations, 0.00 seconds (0.00 work units)

    Nodes    |    Current Node    |     Objective Bounds      |     Work
 Expl Unexpl |  Obj  Depth IntInf | Incumbent    BestBd   Gap | It/Node Time

     0     0    0.00000    0   35   24.00000    0.00000   100%     -    0s
H    0     0                      14.0000000    0.00000   100%     -    0s
H    0     0                      10.0000000    0.00000   100%     -    0s
H    0     0                       8.0000000    0.00000   100%     -    0s
     0     0    0.00000    0   62    8.00000    0.00000   100%     -    0s
H    0     0                       7.0000000    0.00000   100%     -    0s
H    0     0                       6.0000000    0.00000   100%     -    0s
     0     0    0.00000    0   68    6.00000    0.00000   100%     -    0s
     0     0    0.00000    0   47    6.00000    0.00000   100%     -    0s
     0     0    0.00000    0   61    6.00000    0.00000   100%     -    0s
H    0     0                       5.0000000    0.10242  98.0%     -    0s
     0     0    0.10242    0  174    5.00000    0.10242  98.0%     -    0s
H    0     0                       4.0000000    0.12192  97.0%     -    0s
     0     0    0.12192    0  211    4.00000    0.12192  97.0%     -    0s
     0     0    0.37238    0  261    4.00000    0.37238  90.7%     -    0s
     0     0    0.43271    0  281    4.00000    0.43271  89.2%     -    0s
     0     0    0.44203    0  312    4.00000    0.44203  88.9%     -    0s
     0     0    0.44326    0  323    4.00000    0.44326  88.9%     -    0s
     0     0    0.44401    0  261    4.00000    0.44401  88.9%     -    0s
     0     0    0.44503    0  307    4.00000    0.44503  88.9%     -    0s
     0     0    0.44507    0  299    4.00000    0.44507  88.9%     -    0s
     0     0    0.46991    0  241    4.00000    0.46991  88.3%     -    0s
     0     0    0.47586    0  230    4.00000    0.47586  88.1%     -    0s
H    0     0                       3.0000000    0.47773  84.1%     -    0s
     0     0    0.47773    0  252    3.00000    0.47773  84.1%     -    0s
     0     0    0.47921    0  269    3.00000    0.47921  84.0%     -    0s
H    0     0                       2.0000000    0.47940  76.0%     -    0s
     0     0    0.47940    0  285    2.00000    0.47940  76.0%     -    0s
     0     0    0.51429    0  330    2.00000    0.51429  74.3%     -    0s
     0     0    0.52499    0  247    2.00000    0.52499  73.8%     -    0s
     0     0    0.53101    0  258    2.00000    0.53101  73.4%     -    0s
     0     0    0.53456    0  300    2.00000    0.53456  73.3%     -    0s
     0     0    0.53529    0  266    2.00000    0.53529  73.2%     -    0s
     0     0    0.53541    0  262    2.00000    0.53541  73.2%     -    0s
     0     0    0.54632    0  255    2.00000    0.54632  72.7%     -    0s
     0     0    0.55163    0  194    2.00000    0.55163  72.4%     -    0s
     0     0    0.55875    0  294    2.00000    0.55875  72.1%     -    0s
     0     0    0.56420    0  238    2.00000    0.56420  71.8%     -    0s
     0     0    0.57168    0  230    2.00000    0.57168  71.4%     -    0s
     0     0    0.57439    0  199    2.00000    0.57439  71.3%     -    0s
     0     0    0.57473    0  232    2.00000    0.57473  71.3%     -    0s
     0     0    0.57696    0  209    2.00000    0.57696  71.2%     -    0s
     0     0    0.57820    0  234    2.00000    0.57820  71.1%     -    0s
     0     0    0.57904    0  219    2.00000    0.57904  71.0%     -    0s
     0     0    0.58030    0  213    2.00000    0.58030  71.0%     -    0s
     0     0    0.58030    0  214    2.00000    0.58030  71.0%     -    0s
     0     0    0.60733    0  265    2.00000    0.60733  69.6%     -    0s
     0     0    0.62978    0  237    2.00000    0.62978  68.5%     -    0s
     0     0    0.64308    0  213    2.00000    0.64308  67.8%     -    0s
     0     0    0.65302    0  277    2.00000    0.65302  67.3%     -    0s
     0     0    0.66588    0  205    2.00000    0.66588  66.7%     -    0s
     0     0    0.66998    0  262    2.00000    0.66998  66.5%     -    0s
     0     0    0.67787    0  269    2.00000    0.67787  66.1%     -    0s
     0     0    0.68509    0  253    2.00000    0.68509  65.7%     -    0s
     0     0    0.68846    0  290    2.00000    0.68846  65.6%     -    0s
     0     0    0.69325    0  275    2.00000    0.69325  65.3%     -    0s
     0     0    0.69640    0  334    2.00000    0.69640  65.2%     -    0s
     0     0    0.69863    0  344    2.00000    0.69863  65.1%     -    0s
     0     0    0.70100    0  325    2.00000    0.70100  65.0%     -    0s
     0     0    0.70195    0  325    2.00000    0.70195  64.9%     -    0s
     0     0    0.70257    0  336    2.00000    0.70257  64.9%     -    0s
     0     0    0.70297    0  358    2.00000    0.70297  64.9%     -    0s
     0     0    0.70319    0  362    2.00000    0.70319  64.8%     -    0s
     0     0    0.71291    0  343    2.00000    0.71291  64.4%     -    0s
     0     0    0.71693    0  271    2.00000    0.71693  64.2%     -    0s
     0     0    0.71909    0  329    2.00000    0.71909  64.0%     -    0s
     0     0    0.72043    0  346    2.00000    0.72043  64.0%     -    0s
     0     0    0.72323    0  268    2.00000    0.72323  63.8%     -    0s
     0     0    0.72365    0  347    2.00000    0.72365  63.8%     -    0s
     0     0    0.72406    0  378    2.00000    0.72406  63.8%     -    0s
     0     0    0.72438    0  377    2.00000    0.72438  63.8%     -    0s
     0     0    0.72806    0  348    2.00000    0.72806  63.6%     -    0s
     0     0    0.73011    0  312    2.00000    0.73011  63.5%     -    0s
     0     0    0.73182    0  355    2.00000    0.73182  63.4%     -    0s
     0     0    0.73303    0  382    2.00000    0.73303  63.3%     -    0s
     0     0    0.73411    0  349    2.00000    0.73411  63.3%     -    0s
     0     0    0.73452    0  380    2.00000    0.73452  63.3%     -    0s
     0     0    0.73470    0  395    2.00000    0.73470  63.3%     -    0s
     0     0    0.73662    0  297    2.00000    0.73662  63.2%     -    0s
     0     0    0.73671    0  336    2.00000    0.73671  63.2%     -    0s
     0     0    0.73902    0  310    2.00000    0.73902  63.0%     -    0s
     0     0    0.73902    0  277    2.00000    0.73902  63.0%     -    0s
     0     2    1.00000    0  277    2.00000    1.00000  50.0%     -    0s

Cutting planes:
  Gomory: 2
  Cover: 135
  MIR: 233
  StrongCG: 3
  RLT: 46

Explored 139 nodes (45792 simplex iterations) in 2.78 seconds (4.94 work units)
Thread count was 32 (of 32 available processors)

Solution count 10: 2 3 4 ... 24

Optimal solution found (tolerance 1.00e-04)
Best objective 2.000000000000e+00, best bound 2.000000000000e+00, gap 0.0000%

Gurobi 11.0.3 (linux64, gurobi_cl) logging started Sat Nov 15 16:41:10 2025

Set parameter Username
Set parameter LogFile to value "gurobi.log"
Using license file /home/guyutongxue/gurobi.lic
Academic license - for non-commercial use only - expires 2026-10-19

Gurobi Optimizer version 11.0.3 build v11.0.3rc0 (linux64 - "Debian GNU/Linux 12 (bookworm)")
Copyright (c) 2024, Gurobi Optimization, LLC

Read LP format model from file output.lp
Reading time = 0.00 seconds
: 13 rows, 9 columns, 23 nonzeros

CPU model: 13th Gen Intel(R) Core(TM) i9-13900KF, instruction set [SSE2|AVX|AVX2]
Thread count: 32 physical cores, 32 logical processors, using up to 32 threads

Optimize a model with 13 rows, 9 columns and 23 nonzeros
Model fingerprint: 0xabb1822a
Variable types: 0 continuous, 9 integer (9 binary)
Coefficient statistics:
  Matrix range     [1e+00, 1e+00]
  Objective range  [1e+00, 1e+00]
  Bounds range     [1e+00, 1e+00]
  RHS range        [1e+00, 1e+00]
Presolve removed 0 rows and 1 columns
Presolve time: 0.00s

Explored 0 nodes (0 simplex iterations) in 0.00 seconds (0.00 work units)
Thread count was 1 (of 32 available processors)

Solution count 0

Model is infeasible
Best objective -, best bound -, gap -

Gurobi 11.0.3 (linux64, gurobi_cl) logging started Sat Nov 15 16:47:17 2025

Set parameter Username
Set parameter LogFile to value "gurobi.log"
Using license file /home/guyutongxue/gurobi.lic
Academic license - for non-commercial use only - expires 2026-10-19

Gurobi Optimizer version 11.0.3 build v11.0.3rc0 (linux64 - "Debian GNU/Linux 12 (bookworm)")
Copyright (c) 2024, Gurobi Optimization, LLC

Read LP format model from file output.lp
Reading time = 0.00 seconds
: 109 rows, 95 columns, 219 nonzeros

CPU model: 13th Gen Intel(R) Core(TM) i9-13900KF, instruction set [SSE2|AVX|AVX2]
Thread count: 32 physical cores, 32 logical processors, using up to 32 threads

Optimize a model with 109 rows, 95 columns and 219 nonzeros
Model fingerprint: 0x2622caa8
Variable types: 0 continuous, 95 integer (95 binary)
Coefficient statistics:
  Matrix range     [1e+00, 1e+00]
  Objective range  [1e+00, 1e+00]
  Bounds range     [1e+00, 1e+00]
  RHS range        [1e+00, 1e+00]
Presolve removed 1 rows and 9 columns
Presolve time: 0.00s

Explored 0 nodes (0 simplex iterations) in 0.00 seconds (0.00 work units)
Thread count was 1 (of 32 available processors)

Solution count 0

Model is infeasible
Best objective -, best bound -, gap -

Gurobi 11.0.3 (linux64, gurobi_cl) logging started Sat Nov 15 16:51:45 2025

Set parameter Username
Set parameter LogFile to value "gurobi.log"
Using license file /home/guyutongxue/gurobi.lic
Academic license - for non-commercial use only - expires 2026-10-19

Gurobi Optimizer version 11.0.3 build v11.0.3rc0 (linux64 - "Debian GNU/Linux 12 (bookworm)")
Copyright (c) 2024, Gurobi Optimization, LLC

Read LP format model from file output.lp
Reading time = 0.00 seconds
: 16 rows, 12 columns, 28 nonzeros

CPU model: 13th Gen Intel(R) Core(TM) i9-13900KF, instruction set [SSE2|AVX|AVX2]
Thread count: 32 physical cores, 32 logical processors, using up to 32 threads

Optimize a model with 16 rows, 12 columns and 28 nonzeros
Model fingerprint: 0x8c7eca4a
Variable types: 0 continuous, 12 integer (12 binary)
Coefficient statistics:
  Matrix range     [1e+00, 1e+00]
  Objective range  [1e+00, 1e+00]
  Bounds range     [1e+00, 1e+00]
  RHS range        [1e+00, 1e+00]
Presolve removed 0 rows and 1 columns
Presolve time: 0.00s

Explored 0 nodes (0 simplex iterations) in 0.00 seconds (0.00 work units)
Thread count was 1 (of 32 available processors)

Solution count 0

Model is infeasible
Best objective -, best bound -, gap -
